,Tweet Id,Tweet Datetime,Tweet Text,Twitter @ Name,Tweet Coordinates,Place Info,User Location,tag
110,1305602320663797761,2020-09-14 20:20:24, ive suffered through  months of bad service from samsung support  sets of techs have failed to fix an issue with my phone my adv exchange case was clearly forgotten about for a month i was sent the wrong replacement device for my exchange and on top of that the ,i_am_guitarded,,,"Grafton, WI",negative
111,1305602353312169984,2020-09-14 20:20:32, stop giving me unfair solutions for the mistakes you made and refund my money they also wanted my note  that they could not fix i refuse to suffer through weeks without my phone again i dont trust samsung to do the job correctly they are holding my  hostage for no reason,i_am_guitarded,,,"Grafton, WI",negative
112,1305603218869608448,2020-09-14 20:23:58, can confirm it has so hazy that my samsung phone suggested i clean my camera lens for better picture quality  btw normally the north shore mountains are visible from here ,QuinnDuffy,,,"Vancouver, BC",negative
113,1305611519149977600,2020-09-14 20:56:57,samsung expected to launch an affordable cameracentric range of phones this month ,AndroidREDTeam,,,"New York, NY",neutral
114,1305621952342700035,2020-09-14 21:38:25, it has been  days since  was wrongfully taken from my bank account i have called upwards of  times and everyone has told me to continue waiting the department has utterly failed me even after i sent back the replacement device no refund keep waiting horrible,i_am_guitarded,,,"Grafton, WI",negative
115,1305621994990379021,2020-09-14 21:38:35, ive suffered through  months of bad service from samsung support  sets of techs have failed to fix an issue with my phone my adv exchange case was clearly forgotten about for a month i was sent the wrong replacement device for my exchange and on top of that the ,i_am_guitarded,,,"Grafton, WI",negative
116,1305622035356356609,2020-09-14 21:38:45, stop giving me unfair solutions for the mistakes you made and refund my money they also wanted my note  that they could not fix i refuse to suffer through weeks without my phone again i dont trust samsung to do the job correctly they are holding my  hostage for no reason,i_am_guitarded,,,"Grafton, WI",negative
117,1305626484745306120,2020-09-14 21:56:25, hour and  minutes so far on the phone with Transfered multiple times  cannot get an answer for our refrigerator problem And the hold music would make any person insane,hlspring,,,"Chicago, IL",negative
118,1305626526306664448,2020-09-14 21:56:35, except for a microsd card slot for that we are going to upcharge you hundreds of dollars to upgrade to the ultra even though just about every midrange android phone lt has a microsd card slot sorry samsung will not upgrade to a newer samsung phone for crap like this,murixbob,,,"Bossier City, LA",negative
119,1305647308818837505,2020-09-14 23:19:10,i am about to get a samsung phone and just say fuck it,ovokj,,,United States,negative
120,1305655339891781632,2020-09-14 23:51:05, my last phone call said the check was in the mail still waiting,CatherineDWhite,,,Illinois,negative
121,1305656123370934272,2020-09-14 23:54:12,Anyone else finds the customizable hinge on the galaxy fold galaxyzfold as interesting as we do   ,CompletingTheC,,,"Chicago, IL",positive
122,1305663970028683265,2020-09-15 00:25:23,so we have bts samsung galaxy buds yet the  only has airpod cases  can we get galaxy bud cases same for phone cases a samsung case would be appreciated,o_fo2,,,"Austin, TX",neutral
123,1305682372139118594,2020-09-15 01:38:30, the samsung galaxy s  what a beauty that phone will be,Four_EyedLeo,,,Ohio State University ,positive
124,1305698824803950592,2020-09-15 02:43:53, i have the samsung s and the hz screen is highkey my favorite feature lol,ChrisCanovas,,"Vallejo, CA",Son Seungwan,positive
125,1305701919013449729,2020-09-15 02:56:10, how and why is getting the screen to work so difficult the only thing it does is make me want to go to a competitor to buy a better screen for my pc,multiyapples,,,United States,negative
126,1305704381321490433,2020-09-15 03:05:57, samsung latest sensors are going even smaller to deliver thinner phone designs,Lou_Da_DonBkNYC,,,"New York, NY",positive
127,1305709182977544192,2020-09-15 03:25:02, ohhhh  i have verizon  i am on  of new phones from samsung  each phone has terrible voice capabilities  if i call someone i sound muffled  i live in the boonies  that may have something to do with it but bluetooth in my truck works well    i miss dial phones  ,V22_USMC,,,"Texas, USA",negative
128,1305716337176719361,2020-09-15 03:53:28,no i will never forgive samsung for this selfie that was taken on a camera similar to that of a nintendo ds lite ,midgemaisels,,,"New York, NY",negative
129,1305718333002588161,2020-09-15 04:01:24, i hope manufacturers will make these kind of phones again just like the old days but with a way better os really happy with that fold phones from samsung but the price is very high why because no one else is making a phone like that now,bimperks,,,Valhalla,positive
130,1305720362341195776,2020-09-15 04:09:28, i put my samsung note  in an otterbox i probably drop it at least once a month the phone is too slim and slippery without it no problems ,All_Day_SCIfi,,,"Midwest, USA",negative
131,1305791779703144449,2020-09-15 08:53:15, The Samsung watches are great i use a tic watch solid features looks smart and not expensive  The gamin watches are the king of sports tracking,adrianshanahan,,,Ireland,positive
132,1305797302028840960,2020-09-15 09:15:12, That disappointing i need something my Samsung active  has gone in for repair and i am dying to buy a new watch,iiamdarren,,,Essex,negative
133,1305800325996204033,2020-09-15 09:27:12, lol samsung screens dey usually cost pass the actual  samsung phone itself lol,Highman_kingie,,,Nirvana,negative
134,1305813653975949312,2020-09-15 10:20:10, this is the second week in a row my watch has burned me samsung,lbeeler502,,,"Louisville, KY",negative
135,1305835907564658690,2020-09-15 11:48:36,Now in the applications manager there is a section where you can see all the Samsung apps preinstalled on your device instead of having to look for them which is nice ,MintyScripter,,,"Jersey City, NJ",positive
136,1305840561107025920,2020-09-15 12:07:05,i shared a few months ago image sensor from samsung which will be attacking human eye resolution i did not expect there to be anything bigger to overcome this year check the giant camera   this the incredible beast which has at least x higher resolutio…,jakubec,,,"Florence, KY",positive
137,1305853513675747328,2020-09-15 12:58:33, stop promoting this watch when i have been asking for weeks about whe n ecg will be available and you still will not answer do not buy this watch until samsung gives honest and open answer its not worth it,Gogreen20202020,,,Ireland,negative
138,1305864060815183873,2020-09-15 13:40:28, My old Samsung is on its last legs and now i am feeling it is really time to get that new phone,DonnaKennedy63,,,"Texas, USA",neutral
139,1305865797429010432,2020-09-15 13:47:22, my momma got the new samsung note ultra g i know it is a long name a big phone,Cristian1Fort,,,"Pennsylvania, USA",positive
140,1305877803808837632,2020-09-15 14:35:05, i have the samsung type that sits the phone up at an angle press of the button and i can see the time while i am still in bed,geoffcmason,,"St Paul, MN","St Paul, MN",positive
141,1305885234517495809,2020-09-15 15:04:36, Samsung is  more and unnecessarily there no reason to have hz on such a small screen that isnt used for watching live sports or gaming The eyes cant perceive k and like  of content is still shot in p the ram is overkill meant for a desktop,ProdByJKnock,,,"North Lauderdale, FL",negative
142,1305892340200996864,2020-09-15 15:32:50,so apparently the phone i am using now  the samsung galaxy note   is actually worse in many ways than the phone i ditched for this note i thought the note was better little did i know  years between phone releases highend became lowerend in comparison the galaxy a,MirrorHall_Clay,,,"Antioch, CA",negative
143,1305899486808543240,2020-09-15 16:01:14, bought this phone but extremely dissappointed lower specs than my s lower ram camera same no freaking microsd slot samsung please stop repeating yourself you make billions over us but no significant novelty just play here and there and new galaxy or note,mntomac,,,"Ohio, USA",negative
144,1305905749864972288,2020-09-15 16:26:07, i get a new phone most of the time when a new samsung comes out being in real estate my phone is my primary electronic device and my treat to myself is to have the best and newest technology,4salegreensboro,,,"Greensboro,  NC",positive
145,1305911583894274048,2020-09-15 16:49:18, i had a Samsung camera i loved Samsung should stay out of the washing machine business Yes it seems the he appliances are more expensive camp do not operate as well as the old ones,rosalynbecker77,,,"Florida, U.S.A.",positive
146,1305917169482358785,2020-09-15 17:11:30, do not ever go swimming with the Samsung galaxy even in ft of water after  minutes have a worthless phone,Hector_E78,,,"Whittier, CA",negative
147,1305917548882325510,2020-09-15 17:13:01, samsung will not honor their  year warranty will tell you water damage after swimming voided the warranty  why even have a swimming feature on the watch,Hector_E78,,,"Whittier, CA",negative
148,1305919516455702529,2020-09-15 17:20:50, samsung galaxy watch active for me it shows me my calls and my texts and notifications and to accurately track my heart rate that has all i need do not care for anything else,abacjourn,,,"Queens, NY",positive
149,1305920052160462848,2020-09-15 17:22:57, you have to stop advertising the samsung galaxy active as a watch you can wear while swimming  after  minutes in  feet of water the watch is now useless  trying to charge  for repairs is ridiculous  ticket ,Hector_E78,,,"Whittier, CA",negative
150,1305920540419399680,2020-09-15 17:24:54,self portrait inspired by i decided to try taking photos on my Samsung galaxy s and i will sayi cannot believe i did not know how sick this camera was  ,immodeling,,,"Los Angeles, CA",negative
151,1305920863733272577,2020-09-15 17:26:11, rest in peace samsung galaxy watch ,Officialne0tic,,,Sweden,neutral
152,1305921302742683648,2020-09-15 17:27:56, heh my first cell phone was a basic sliding keyboard samsung something or other even though smartphones were the thing i cannot imagine ever buying a  phone for a kid let alone a watch the smart watch i bought myself was around  ,MZGSZM,,,"Minnesota, USA",neutral
153,1305922735596470273,2020-09-15 17:33:37, finding out the accuracy of it will be key samsung added an o sensor to the s phone and they had to walk it back because it was not much better than a dowsing rod,elijah_zupancic,,,"Seattle, WA, USA",negative
154,1305928168814137345,2020-09-15 17:55:13, yea trash for the amount of money it going to cost it a shame samsung zfold  has a hz display a damn folding phone has the higher refresh rate than apples device smh lol but we will see,R0bSkii,,,"Bronx, NY",negative
155,1305928542115360768,2020-09-15 17:56:42,my phone is so old most emojis appear as boxed x but i will not replace it because i love it for one simple reason it cannot be broken my old ass samsung is indestructible and i need an unbreakable phone because i am clumsy as fuck thank and fuck you ms,Essem_Jay,,,"Seattle, WA",positive
156,1305931700787126273,2020-09-15 18:09:15, i agree man i just wasted my day to watch that nonsense i feel like purchasing a z fold from samsung now,JosephM36944698,,,"Brooklyn, NY",neutral
157,1305943379784728577,2020-09-15 18:55:39,picked up the galaxyzfold today and it is absolutely stunning i am in love already with this inner display  samsung killed it with this device for sure zfold,KingBran1020,,,"New Port Richey, FL",positive
158,1305943636098666497,2020-09-15 18:56:40, does not even say it has a Samsung phone Also billions accidents happened and every brand has had problems with faulty batteries,jmsgrgry_,,,"Tennessee, USA",neutral
159,1305944894775721985,2020-09-15 19:01:40, Works for me and i am on a Samsung phone,CameronBH43,,,"Dunn, NC",neutral
160,1305950172141285376,2020-09-15 19:22:39, i jumped ship a couple years back when i realized that paying k all the time for a phone is madness i found a samsung galaxy s i think about  months after it had launched  or so brand new and it has a very good phone oneplus makes some great phones too,Bright_Pixels,,,New York,positive
161,1305950906811256832,2020-09-15 19:25:34, God damn it motherfucking hell When i out my motherfucking phone on low power mode do not turn that bitch off to charge the god damn device and then leave it on once charging has sealed during up my god damn battery be like and speaking of Samsung,draaliyahlinden,,"Santa Monica, CA",Central Fourty Six Metaverse,negative
162,1305955154378792960,2020-09-15 19:42:26, i have im on the phone samsung right now after spending  hours on the phone being bounced between samsung and home depot i still havent had any assistance this is the worst customer service ive ever experienced,Abby_Jayne9,,,"Boston, MA",negative
163,1305957684764528640,2020-09-15 19:52:30, nothing beats an actual cell phone  i have an old samsung gravity iii that i use as a burner  i put a fresh battery into it and i charge that thing twice a month,Todd_Bonzales,,,"Seattle, WA",positive
164,1305961245468766213,2020-09-15 20:06:39, running through xcloud on my samsung s pretty cool to exprience a game you have worked on on such a service guess we need a mobile audio mix now  gameaudio ,idosounddesign,,,Denmark,positive
165,1305964410004025346,2020-09-15 20:19:13,throwback to when i first got my phone and would use the iris unlock feature just to have samsung tell me to open my eyes every time ,plainjigsaw,,,BLM,neutral
166,1305969365729255424,2020-09-15 20:38:55, samsung galaxy gear s watch or newer model rugged enough for mtb and good nd ref watch,LParkerIII,,,"South Pasadena, CA",positive
167,1305977453404327936,2020-09-15 21:11:03, Sometimes it works My Samsung has a “Samsung health app that uses my device pulse reader to check my o as well Hopefully you guys recover through this,KrakenLr,,,"Santa Monica, Ca",positive
168,1305978967627714560,2020-09-15 21:17:04, just part of my day  trying to shop for a new phone yeah my life like that after all i have been going through with you all just as i asked for refund hubs texted to tell me his screen cracked and the charger port is smashed he wants a samsung s he is viewing on amazon,HTitusSweany,,,Southern California,positive
169,1305982012835000320,2020-09-15 21:29:10, Samsung is going to take number one phone manufacturer my guess quarter one of  also your threat is empty,LuisAcosta936,,,"Phoenix, AZ",positive
170,1305983538982862848,2020-09-15 21:35:14, samsung is doing great despite having exploding phones an executive convicted of corruption and losing an ip lawsuit they are kind of the only highend g phone unless you go for the asus rog phone  which i hear you can use to boil water,znmeb,,,"Portland, OR",positive
171,1305986004134764545,2020-09-15 21:45:02, samsung accessories because not all average people have our want a samsung phone but all could benefit from a universal accessory,ultimatealdin,,,"Utah, USA",neutral
172,1305986363167211520,2020-09-15 21:46:27,took a few pics of the sun and moon with my phone and i am pleased with the results until i can afford a samsung dslr camera i will push the limits of my phone samsungnoteultra samsung nofilter ,miggz1987,,,"Granby, MA",positive
173,1305987980662800394,2020-09-15 21:52:53, everyone who has a compatible samsung device,LTEstyles,,,"Manhattan, NY",neutral
174,1305988453272883200,2020-09-15 21:54:46,few things aggravate me more than being on the phone with customer service about a problem with your existing products and then they try to sell you more products while youre troubleshooting maam i just want my wifi to work i do not want satellite tv or samsung devices,_youaremore_,,,"Jackson, MS",negative
175,1305993206719447042,2020-09-15 22:13:39,samsung  i am appalled that in order to use the notes i stored in my phone i now have to let you access my files and pictures fuck you samsung ,onlythetruth007,,,Ontario,negative
176,1305994453816049664,2020-09-15 22:18:36,Thanks for nothingaccording u it perfectly acceptable for a chrome book hinge to breakampcrack the screenampthen not cover “physical damage under a yr warranty Bought  Screw service plan it should be replaced th grader sol,imlostinboston,,,"boston, ma",negative
177,1305998848523993088,2020-09-15 22:36:04, put it behind the screen like samsung ,Uncle_Vim,,,"Ottawa, ON",positive
178,1305999391862521861,2020-09-15 22:38:13, Nope i used that and a secondary app Still do with my Samsung watch,syddee_boo,,,New Orleans,neutral
179,1306003781155524608,2020-09-15 22:55:40, American androids have  imam Why So the government can have a back door They did not buy my phone Bastards  Then they cut the square out Lawsuit ,yolanda_riggins,,,"San Antonio, TX",negative
180,1306007072010571776,2020-09-15 23:08:45, personally my samsung galaxy watch works great for texts emails callsplus counting my steps excercize stuff,MsAimeeV,,,"Schertz, TX",positive
181,1306008230687117313,2020-09-15 23:13:21, galaxyg if you would so kindly find it in your  camp send me one So i can stay connected with my daughter campgrandson who lives in phoenix Arizona My Samsung se has a badly cracked screen i cannot do video calls i miss their faces,ErholmKelli,,,Bellingham Washington,negative
182,1306012424265502721,2020-09-15 23:30:01, but i could be happy with samsung watch  too if i stick with the fold  since it does all of what i need and looks more like a watch than a gadget,ItsRyanBates,,,"Las Vegas, NV",positive
183,1306014863207137280,2020-09-15 23:39:42, my next phone will most likely be a samsung,LifeMaverick6,,,United States,positive
184,1306015440540295168,2020-09-15 23:42:00,this is samsung latest foldable phone the galaxy z fold  ,CheddarGadgets,,,"New York, NY",neutral
185,1306016345918709760,2020-09-15 23:45:36, i agree i have a samsung phone no it has not the latest and greatest but it works well for me and i did not have to take put a loan and sell a kidney to afford it there has a reason they are rich and we are definitely not ,CaryKerns,,,"Oak Island, NC",positive
186,1306019702838362113,2020-09-15 23:58:56, i will change phone this friday thinking of samsung any model that you can suggest looking for work efficiency hehe,dihiansaaaaan,,,Somewhere in Brooklyn,positive
187,1306020564088303616,2020-09-16 00:02:21, So frustrated watch is under warranty cannot contact via phone online web Need to get watch repaired  months old Samsung us could not even get through via phone  Why cannot Samsung fix my brand new active ,wellinsm1,,,"Muskego, WI",negative
188,1306024153179455488,2020-09-16 00:16:37, samsung galaxy note ultra as my work phone,wontfindruiz,,,Kansas City,neutral
189,1306031933676236800,2020-09-16 00:47:32, samsung has a couple the one ive been paying attention to is their galaxy watch active  but i know they also have a galaxy watch ,Khaleel,,,Jamaica,neutral
190,1306032439773388802,2020-09-16 00:49:33,just got the noteultra so samsung wanted to make the phone super thin but the camera and only the camera is super thick so the phone is offkilter when you set it down honestly they should have just made it as thick as the camera required to avoid that awkwardness,GarionOrb,,,"Renton, WA",negative
191,1306032793315692544,2020-09-16 00:50:57,this was my credit card when i wanted to order the new samsung phone today my credit card rolled its eyes and slid back into my wallet  ,DLano973,,,New Jersey. USA,negative
192,1306037370089865220,2020-09-16 01:09:08,samsung tv app is lifesaver i lose the remote every two minutes and just navigate the tv from my phone like wow technology has blossomed in a few years,moneymonz_,,,"Atlanta, GA",positive
193,1306047184660508672,2020-09-16 01:48:08, i have thought about buying a samsung watch but really do not feel like spending the money on something i cannot see myself using,TJMWestfield,,,"Westfield, IN",neutral
194,1306050973459247104,2020-09-16 02:03:11, i have it tooi like it as a smart watch but it is crap for anything fitness related  The optical heart sensor is junk and has been on every Samsung watch  Hopefully they will be able to fix that eventually,michaelherald,,,"Bella Vista, AR",negative
195,1306058836378353666,2020-09-16 02:34:26, This is a good reason to get a new phone My Samsung galaxy s is slowly dying i have had it for like at least  years can you come up with a good argument for me to use on my dad Lol hold that thoughtthank you its for being u love army Beth g,missha411,,,US,positive
196,1306059132513013761,2020-09-16 02:35:37,a screen shot of the video  the footage is very blurry guess samsung cameras are still pretty rough ,ScarTheFurry,,,"Michigan, USA",negative
197,1306059432837742593,2020-09-16 02:36:48, the only thing missing is a landscape camera for remote learning samsung did it for tab ,Robin621k,,,NYC,positive
198,1306070520979501056,2020-09-16 03:20:52,samsung is producing worst oleds screen burning is common problem in them,AshuftaSr,,,"New York, USA",negative
199,1306076562610155521,2020-09-16 03:44:52, it has a commodity component that everyone can use Samsung use both optical and ultrasonic depending on the device,omonomono,,,NY/NJ,neutral
200,1306081380523278336,2020-09-16 04:04:01, this looks just like my old samsung phone like literally there was these same things,lbharrys,,,rainbow paradise,neutral
201,1306085581861130241,2020-09-16 04:20:43,i really want to upgrade my samsung watch to the  ,sbrooke_04,,,"North Dakota, USA",neutral
202,1306096384156733447,2020-09-16 05:03:38,also happy i switched back to my samsung phone ,peachyahxo,,,United States,positive
203,1306103746854662144,2020-09-16 05:32:54, samsung intensity was my first phone,KevinBreezeTV,,,"Phoenix, AZ",neutral
204,1306104036295204864,2020-09-16 05:34:03,samsung intensity was my first cell phone ,KevinBreezeTV,,,"Phoenix, AZ",neutral
205,1306106428977893376,2020-09-16 05:43:33,do you remember that advertising campaign for the samsung galaxy s or s they highlighted the new product feature where ur phone physically touches someone else phone and you exchange files  was that the dumbest new product feature ever,ozanjaquette,,,"Los Angeles, CA",negative
206,1306161775268691970,2020-09-16 09:23:29,samsung is the top smartphone maker this year ,DaniDanielsOne,,,"Orange, CA",positive
207,1306181901686730752,2020-09-16 10:43:27,samsung android chrome how can i get more detailed view of browsing history  google search  ,MickMonroe,,,North America,neutral
208,1306183961014566912,2020-09-16 10:51:38, it a major os update it going to change the way the apps are organized add widgets finally and also have incoming calls in a bar on top they are finally catching up to samsung look it up and back your phone up,beejyb,,,Pittsburgh,neutral
209,1306201349177200642,2020-09-16 12:00:44,After a week of use it is clear that the galaxyzfold is likely  favorite phone of the year Find out why in our full review ,xdadevelopers,,,USA,positive
210,1306202187157188610,2020-09-16 12:04:04,samsung will soon take  of the nextgeneration smartphone market  ,ustodaynewslive,,,USA,neutral
211,1306207633892872192,2020-09-16 12:25:42,i just read samsung galaxy z fold  review likely the phone of the year  by  android news droid ,Othershawnlong,,,"Indianapolis, IN",positive
212,1306208811754172417,2020-09-16 12:30:23,galaxy z fold  review samsung gets it right deskwaves ,Deskwaves1,,,"California, USA",positive
213,1306209142290472960,2020-09-16 12:31:42,What the hell   This firmware issue has gone on long enough over a month Fix this nonsense asap or this will be the last Samsung device i purchase Comon now ridiculous fed up annoyed ,FCakaGMan,,,"Florida, USA",negative
214,1306210399654760449,2020-09-16 12:36:42,samsung is back in  with the samsung galaxy s ultra this is a big powerful phone with some nice features and a hefty price tag i will tell you everything you need to know about this phone in my samsung galaxy s ultra review  ,anewcellphone,,,United States,positive
215,1306213231120220160,2020-09-16 12:47:57, My Samsung phone had that i miss this feature,tpoi,,,"Montréal, Québec",positive
216,1306220389962579968,2020-09-16 13:16:24,from mp to mp samsung is going smaller with its latest camera sensors  ,JoanneWright791,,,"Kansas City, MO",neutral
217,1306225347894050820,2020-09-16 13:36:06, Yeah that is one thing i really like about the Samsung watch and that it looks like a regular watch and that battery life is insane,TechnicallyTee,,,"Atlanta, GA",positive
218,1306227659572158469,2020-09-16 13:45:17,regarding the new blood oxygen sensor on the applewatch  samsung has had blood oxygen sensors on their phones since the s model  i recently bought on amazon a watch with blood oxygen sensor for us  i bought several units for my family,Brioneja,,,"Houston, TX, United States",positive
219,1306229179051126784,2020-09-16 13:51:19, watch the battery on that samsung might lose a ass cheek,MrKing3_0_5,,,United States,negative
220,1306234081273884673,2020-09-16 14:10:48, Clearly mine failed so what is your point Samsung should replace my watch since they clearly do not have the replacement parts,Purpleicious,,"Manhattan, NY",10002,negative
221,1306235490199367685,2020-09-16 14:16:24, your shoddy products fail within months you have been repairing my watch for a month now just send me a new one,Purpleicious,,"Manhattan, NY",10002,negative
