,Tweet Id,Tweet Datetime,Tweet Text,Twitter @ Name,Tweet Coordinates,Place Info,User Location,tag
222,1306236522451079169,2020-09-16 14:20:30, do not get anything from samsung their shoddy products fail within months you have been repairing my watch for a month now just send me a new one,Purpleicious,,"Manhattan, NY",10002,negative
223,1306240349623517185,2020-09-16 14:35:42,samsung has both  i miss my phone ,macyazzyy,,,"Charleston, SC",positive
224,1306244072164732930,2020-09-16 14:50:30,i am dumbfounded that has yet improved this ecosystem if i have Samsung pay on my phone i should not have to reline all my cards individually again to my Samsung pay watch app Whoever thought of this is retarded,ReallyAdriel,,,"Winter Park, FL",negative
225,1306247420146315265,2020-09-16 15:03:48,Please explain how you claim this watch is waterresistant and has a swimming mode ,dontbemad,,,"Washington, DC",negative
226,1306248384882278401,2020-09-16 15:07:38, i had my phone stolen in Barcelona some years ago i lost the pics from that trip but phone company and Samsung got most everything else back i hope you have a similar miracle,ATLCitizenBeth,,,"Atlanta, GA",positive
227,1306252256908660737,2020-09-16 15:23:01,i sent my phone back to samsung for warranty exchangerepair it is so weird not having a phone,vonralls,,,"Olive Branch, MS",neutral
228,1306269338282885122,2020-09-16 16:30:54, i am on a samsung phone and it also did not work for me,A_ru_ba,,,New World,negative
229,1306276199954554883,2020-09-16 16:58:10,tbh apart from the camera quality i think the s was better than the s wtf samsung,ocia_bear,,,"SL,UT",negative
230,1306276617392664578,2020-09-16 16:59:49, Now with hotshot on s not working after system update pushed to phone i am supposed to call Samsung wow ,bp_guy,,,"north of ATL, GA",negative
231,1306305391412862978,2020-09-16 18:54:09,my st tweet on the samsung galaxy z fold  this is by far the most insane phone of  i cannot believe what i am holding right now,Marks_Tech,,,United States,positive
232,1306309523817279491,2020-09-16 19:10:35, samsung has pretty good camera quality i only have a tablet though i have not used the flash yet editing is real easy with it as well i still have my old tablet if you want to take pictures with it does not have a flash though,ParksCamarocmp,,,"Knoxville, Tn",positive
233,1306317020330221568,2020-09-16 19:40:22, yeah the new samsung tablet is a beautiful device also the se had a fingerprint scanner on the power button,prdyt,,,many ,positive
234,1306318686396067846,2020-09-16 19:46:59,Super interested in wing phone if it can net a solid battery life i may be leaving Samsung,Will0Way,,,"Pittsburgh, PA",negative
235,1306319524690567170,2020-09-16 19:50:19, i have been double charged for samsung care due to an error with my phone order i have been disconnected on chat twice and i would like this resolved,Galadon,,,"Greenwood, IN",negative
236,1306319720946204675,2020-09-16 19:51:06,dennis has a samsung so i was thinking of getting him a galaxy smart watch but i dont know anything about them does any one have any recommendations,bellarogerio,,,"Pflugerville, TX",neutral
237,1306319906858840064,2020-09-16 19:51:50, wait till you get a samsung youll be waiting months after the update is out for it to actually be officially compatible with your phone,HelperTesla,,,"Houston, TX",negative
238,1306340317994479616,2020-09-16 21:12:57, same i have samsung every and that shit is so clutch  i get clowned for green bubbles but there is literally nothing my phone cannot do,opph20,,,"Las Vegas, NV",negative
239,1306341093743693834,2020-09-16 21:16:02, i asked to send these back camp for a refund camp case GMT said no said i have to keep these even though i was promised buds after doing this process x i am not be buying Samsung watch now Way to treat your customers  Stand behind your words,ChadKafka,,,"Milwaukee, WI",negative
240,1306341252435075072,2020-09-16 21:16:39, told me to call  last night for what he was about to do while i was shooting ringside but my phone was dead   do not blame me blame samsung,justin_cesi,,,"West Hollywood, CA",negative
241,1306341706074329089,2020-09-16 21:18:28,let me leave in the morning i had a crappy samsung galaxy prime i bought a few months ago that has enough memory for  apps and a spare sim card called  from it and got myself phone service with data and got myself a ride that spare phone saved my life ,astralmonad,,,Toledo,negative
242,1306360930226204672,2020-09-16 22:34:51,tested this out playing gow  on my samsung phone the response time and vdo quality are absolutely stunning xcloud ,TheeEdge,,,"Seattle, WA",positive
243,1306375025524576256,2020-09-16 23:30:52,my dad mad as hell his samsung phone stopped working today it the galaxy edge s he bought in december of ,darthvenum,,,"Los Angeles, CA",negative
244,1306379059669078016,2020-09-16 23:46:53, Wrong phone,redban,,,"BURBANK, CA",negative
245,1306379454495821825,2020-09-16 23:48:27, i do not think it has very valvelike to make a mobile or system And what indications do you have that Samsung gave up on or i think the odyssey went AOL around the same time as hp revert  for a reason,Tsukinune,,,Wisconsin,neutral
246,1306380943947522049,2020-09-16 23:54:23, i have a samsung s and it works great camera is ok definitely not as good as the ,ThatOneKendall,,,"Ohio, USA",positive
247,1306395479736029190,2020-09-17 00:52:08, My Samsung galaxy  has a camera that creates light in photos where there is hardly any without using flash ,Ravenlovely452,,,"Nashville, TN",positive
248,1306396639716880384,2020-09-17 00:56:45, This is officially my last Samsung phone ever i have had a case and a screen protector on since the day i bought it  years ago and my screen just cracked for the second time  times in  years Really For an  phone i expect better Google,sunshine50cal,,,"Virginia, USA",negative
249,1306407708665565184,2020-09-17 01:40:44, why does it take forever and a day to get my and receive my  dollar credit they get my phone right away but yet i have to wait  days it the ignorant things like that is what irritates me about ,shadow101066,,,Illinois ,negative
250,1306409384033939457,2020-09-17 01:47:23, yes you can reset the phone back to factory settings after attempting to enter pass codes a certain number of times which is maybe  times  i have done it with a samsung s about a month ago ,seaboldb4,,,"Arizona, USA",neutral
251,1306410988359557123,2020-09-17 01:53:46,what was your first phone mine was a samsung pocket,TheOmarSahyoun,,,Lebanon,neutral
252,1306413040439562241,2020-09-17 02:01:55, lmaooo i loved it so much i downloaded it when i had a samsung  amp i kept the phone ,AllAboutMB__,,,"Cleveland, OH",positive
253,1306425050560696321,2020-09-17 02:49:38,i would like to know how unlock my brother samsung galaxy s without going to factory reset my brother past away last month i do not want to mess anything that he had on the phone i need to know what can do    ,DaSisqoKid,,"Manhattan, NY","New York, NY",neutral
254,1306432481474813953,2020-09-17 03:19:10, bruh what was samsung thinking including that garbage at that point it not even a screen protector by how it looks just a horrible film,BigBoyKegan,,,"Houston, TX",negative
255,1306448324954906624,2020-09-17 04:22:07, on  samsung galaxy s ultra major camera improvements ,RJ_Y16,,,"Shirley, NY",positive
256,1306451221830602752,2020-09-17 04:33:38,i am have you seen the new tabletphone by samsung  heck yesssss,Hasmeen11,,,"Texas, USA",positive
257,1306454594063446017,2020-09-17 04:47:02,samsung launches third generation of foldable device — galaxy z fold  options the edge  ,9wireless,,,"Silicon Valley, California",neutral
258,1306459850059051010,2020-09-17 05:07:55,samsung phone users might find this new capability comes in handy i know i will  in samsung note you can now create a new note as a pdf file or import existing pdf and edit ,OahuShopSmarter,,,"Oahu, Hawaii",positive
259,1306489223227138053,2020-09-17 07:04:38, i wish i had the money to change my phone for an amazing beautiful samsung s plus ultra,scheidemann,,,"West Hollywood, CA",positive
260,1306492259517345792,2020-09-17 07:16:42, This article talks about how the first version of the phone were breaking Look towards the bottom of the article ,DESIIREUX,,,"La Mirada, CA",negative
261,1306496951249063937,2020-09-17 07:35:21,i still really want the samsung flip phone,plllea,,,"Montréal, Québec",positive
262,1306511874012385280,2020-09-17 08:34:39, Still Samsung says not to take it off or it could damage the phone,DESIIREUX,,,"La Mirada, CA",neutral
263,1306525049655099393,2020-09-17 09:27:00, you couldbut you would have to switch to samsung or another type of android phone ,sabrinamelipaul,,,"Miami, FL",neutral
264,1306552797861761025,2020-09-17 11:17:16,if it is not i am upgrading to a better samsung phone so i can play fortnite on it,TheGuest6585,,,"Greenwood, IN",neutral
265,1306558399707074561,2020-09-17 11:39:31, Hey Samsung You promised to send a technician to come and watch at my TV last week no call or show You never returned my call yesterday either Very disappointed cannot watch my TV here the ticket  ,fititfitness,,,"Leesburg, VA",negative
266,1306558816633458688,2020-09-17 11:41:11, samsung promised to send a technician to come and look at my tv last week no call or show they never returned my call yesterday either very disappointed cannot watch my tv here the ticket  ,fititfitness,,,"Leesburg, VA",negative
267,1306566542507880456,2020-09-17 12:11:53, i am not sure how to do this on my samsung mobile device,Only1LMH,,,Croydon,neutral
268,1306571528520249344,2020-09-17 12:31:41,i am quite impressed by samsung service  they are going to come and pick up my smartphone and bring it back once it is fixed which is amazing for everyone but especially someone like me who cannot go to a service center due to disability we need more services like this,CraftyRenate,,,Belgium,positive
269,1306571996453634054,2020-09-17 12:33:33, Same on the Samsung app mine still says ship by September  but i havent seen any movement or any new updates so seems like me getting my phone tomorrow may not be in the cards,venomous95ss,,,United States,negative
270,1306582451112873986,2020-09-17 13:15:06,the samsung note series is officially here this is not a smartphone as you know it this is a computer suite in your pocket this is nextlevel gaming on mobile this is a prograde k camera and editing suite ,SmartCellDeals,,,Ontario,positive
271,1306588506601467904,2020-09-17 13:39:09, Bought new note ultra  and accidentally canceled care  after buying phone while i was trying to return the wrong case now they will not enroll me even it has not been  days yet,Drew1200c,,,"Melbourne, FL",negative
272,1306589493726765056,2020-09-17 13:43:05, Try a Samsung galaxy they are far better camp china does not have a backdoor into your phone,Lynn21769890,,,"Florida, USA",positive
273,1306600784977473539,2020-09-17 14:27:57,  on my third replacement s phone for overheating and not chraging  seriously doubt i would ever purchase another phone from samsung,handystanley,,,"Brightwood, OR",negative
274,1306603298321915910,2020-09-17 14:37:56,galaxyzfold and galaxyzflip are two incredible device form factors showing how smartphones will be in a few years has hit a home run with their foldable category this year thanks to samsung smartphones are cool again,chakkaradeep,,,"Redmond, Washington",positive
275,1306610502060183554,2020-09-17 15:06:33,a little under a month now with the samsung galaxynoteultra withgalaxy the device is more than capable of handling any task extremely well for me it is the photography and how i am able to capture the best images possible i highly recommend it and   ,iamwaynegilbert,,,"Brooklyn, NY",positive
276,1306613428551913474,2020-09-17 15:18:11, thanks for your interest in galaxy s g bts edition at this time the device is not available in canada hope you enjoy the galaxy buds bts edition available to order now for a limited time use code ipurpleu to save  termsconditions apply ,SamsungCanada,,,"Canada, Toronto",neutral
277,1306617419994214402,2020-09-17 15:34:03, i use a samsung tablet really easy to read pdfs from files either downloaded onto the device or from google drive,LTaylor620,,,"Atlanta, GA",positive
278,1306617614261800965,2020-09-17 15:34:49, hmm the thing is my phone is a samsung a,TangledLion,,,Location,neutral
279,1306624305699184641,2020-09-17 16:01:25, that actually looks tight for real too bad they dont have anymore pictures of it i was wondering when there was going to be some other android phone maker that tried to rival samsung cuz its not even close,nselvaggio1,,"Fox Chapel, PA",,positive
280,1306625379000492033,2020-09-17 16:05:40, my daughter samsung tablet stopped working  yesterday  online school is not going to be fun today  do you have some deals on tablets for t mobile customers,dits21,,,"Bothell, WA",negative
281,1306633829587841024,2020-09-17 16:39:15,breaking  samsung new phone introduces ss tap coming march  ,Austin_UF,,,"Georgia, USA",neutral
282,1306634101491982336,2020-09-17 16:40:20, The s is a great feature rich device too i had a great time with mine Have you explored the trade in route at Samsung site it certainly makes the decision a bit easier And save you quite a few bucks,iamwaynegilbert,,,"Brooklyn, NY",positive
283,1306635241247764480,2020-09-17 16:44:52, The last four Samsung have been the exact same device but gotten more and more expensive Like to the point where phones are cheaper than Samsung flagships,kylecoolky,,,"Lawrenceville, GA",negative
284,1306640057848205313,2020-09-17 17:04:00,one of my favorite new features on samsung one ui   video   oneui samsung  ,jimmyispromo,,,"Midwest, US",positive
285,1306641646964989953,2020-09-17 17:10:19,thoughts on the galaxy fold after  hours this form factor is extraordinarily cool and from a hardware standpoint feels remarkably polished software remains a pinpoint mostly because android is not equipped to handle a device like it and samsung can only do so much,SnazzyQ,,,"Salt Lake City, Utah",positive
286,1306642772674273280,2020-09-17 17:14:47,one of the reasons i missed samsung  being able to customize my home screen appleios ,lindalam503,,,"Portland, OR",positive
287,1306642967571165185,2020-09-17 17:15:34, what about a samsung phone,SproutThePlant,,,"Miami, FL",neutral
288,1306649194913058816,2020-09-17 17:40:19, i have a Samsung s using Samsung flow get to watch Milan app full screen no issuesno wires needed hope this helps,ACMClubMTL,,,Montréal,neutral
289,1306649623503671297,2020-09-17 17:42:01, samsung i have been waiting for the refund or  return of my active  watch that your company stole from me back in june  your rude case manager hung up on me as soon as a said hello i was on hold for half an hour now i have to try again samsung company are crooks,eznun213,,,"Los Angeles, CA",negative
290,1306650381787607040,2020-09-17 17:45:02, Hi Samsung still waiting for the return of my active  watch that you guys took back in June When am i getting my repaired watch or refund i am on hold a second time for about  minutes First time your case management person said hello after a half hour wait then hung up,eznun213,,,"Los Angeles, CA",negative
291,1306650936601767937,2020-09-17 17:47:14, hi samsung you guys have possession of my active  watch since june  i have sent it to reclasp the backing and i never got it back the watch was about a week old shame on your company i am not getting truthful answers,eznun213,,,"Los Angeles, CA",negative
292,1306651047797104641,2020-09-17 17:47:40, i want a widget for my Samsung watch too,Longhorn_Rick,,,Southern Maryland ,neutral
293,1306652097031680000,2020-09-17 17:51:51, A passion to be sure but that is also a standard preset in my Samsung phone ,OhYeahLasers,,,"Ann Arbor, MI",neutral
294,1306654053821104128,2020-09-17 17:59:37, used to have  separate monitors vertical rather than horizontal  replaced with a  curved samsung been working beautifully for about  yrs i do computer programming and trading i have about  more screen space compared with the  monitors no burn in problems,LawrencesSnyder,,,"Bay Area, CA",positive
295,1306659371791732736,2020-09-17 18:20:45, is that a samsung s ultra right therethat has like a  dollar phone why did not she get a cheaper device and donate money to the people she has claiming to support,HipsterMrMoon,,,"Salt Lake City, UT",negative
296,1306661316736757760,2020-09-17 18:28:29, Nope i have a large screen Samsung smart TV love it i am fine,6022jsm,,,"Florida, USA",positive
297,1306661507233705989,2020-09-17 18:29:14,got the new samsung a phone trying to be super careful with my new baby until my new case comes in ,Adorkable_Bree,,,United States,positive
298,1306680284008644613,2020-09-17 19:43:51, no thanks had fossil generation  and used my samsung sport more battery life is awful and apps are terrible wish i could trade it in for the new samsung watch i think they need to fix the apps before building more devices,RudyFlyer4,,,Illinois,negative
299,1306681530866073600,2020-09-17 19:48:48,Galaxy z fold  first impressions after  hours This is the future  What a fantastic phone  Samsung did a home run,Marks_Tech,,,United States,positive
300,1306687214311616513,2020-09-17 20:11:23, A literal hole in the glass on the screen i have no idea do not complain about being fragile plastic because i dropped my galaxy s and it has no scratches at all Matter of fact i dropped it in water today on accident Works fine No problem Sgt,Cyanyde3,,,"Florida, USA",positive
301,1306687255914917888,2020-09-17 20:11:33,i had not really noticed them until the note ultra but man i am getting so many push ads from samsung on this phone probably  a week at this point it is really gross,RDRv3,,,"Bay Area, CA",negative
302,1306699602524078080,2020-09-17 21:00:37, Hate their phones too i had a galaxy  and  and alls had abysmal battery life and felt sluggish after  months My Leno made motor z play has been leagues above any Samsung phone i have owned,neomerge,,,"Woodstock, Ga",negative
303,1306701313552650240,2020-09-17 21:07:25,wait are you telling me the bts edition of the samsung s is sold out and they will not have more that cloudy purple is literally all i want my phone to look like,carlottaatlast,,,"Miami, FL",positive
304,1306702494999998464,2020-09-17 21:12:06,got a new phone it has the new samsung galaxy note thing  cannot wait to take even better lewd pics and videos now x,LyallWolfe,,,"Katy, TX",positive
305,1306707036172890112,2020-09-17 21:30:09,samsung image processing is ruining your photos ,inputmag,,,"New York, USA",negative
306,1306707563107495939,2020-09-17 21:32:15,overhearing people complain their samsung phone cant read a qr code menu…  you got what you paid for,Archimage,,,"Dover, DE",negative
307,1306716621604556802,2020-09-17 22:08:14, samsung watches work with any android phone,jordokream,,,"Michigan, USA",positive
308,1306721308860755975,2020-09-17 22:26:52, i would recommend the samsung s line you can pretty much ignore the s ultra unless you absolutely need the x space zoom the s is the better value if you are looking for a great phone,amsherley,,,Coos Bay Oregon,positive
309,1306722876020543488,2020-09-17 22:33:06,My new favorite thing about my fridge is being able to immediately share all the funny memes i see on the screen for my family,LilithRainn,,,United States,positive
310,1306729703491821568,2020-09-17 23:00:13,i am loving my new samsung galaxy note  ultra in mistic white thank you ampt for finding where my missing phone went received it yesterday ,cainalex312,,, Alaska,positive
311,1306731183233929216,2020-09-17 23:06:06,oh no apparently i got the black screen of death on my samsung tv ,jeanay_nay,,,SEA,negative
312,1306732241012379650,2020-09-17 23:10:18,Kind of bummed my TV which is less than  years old has bluepurple spots scattered on the screen Of course out of warranty so highly unlikely will do anything at all weave standbehindyourproduct makeitright,MThompson622,,,"chicago, il",negative
313,1306738115340574725,2020-09-17 23:33:39, Lolol i thought he was talking about some jelly from UK but its actually Samsung That phone sucks,Nenelawrence1,,,"New York, NY",negative
314,1306743404815097856,2020-09-17 23:54:40,the samsung galaxy a is one of samsung midrange phones for  this phone has a big display screen with lots of rich and vibrant colors  ,anewcellphone,,,United States,positive
315,1306751027958501381,2020-09-18 00:24:57,tab s wallpapers look great on the phone too teamgalaxy samsung ,fmclapham,,"Riverside, MD","Harford County, Maryland",positive
316,1306759028056481794,2020-09-18 00:56:45,unpopular opinion samsung galaxyzfold does not spark my interests  i will watch videos about it but i will never own one,KevinSliter,,"Michigan, USA","Michigan, USA",negative
317,1306759727175491586,2020-09-18 00:59:32,this was a damned sexy phone chromed up super tight amp small running windows mobile  it was like a candy bar smartphone with all the functionality of real touch screen wm phone samsung i omnia  wikipedia  ,kurtsh,,,"Los Angeles, CA, USA",positive
318,1306760554531426305,2020-09-18 01:02:49, i really meant samsung when i said this i have never seen a samsung phone that i didnt think looked ugly ,skeleloon,,,"Atlanta, GA",negative
319,1306762114439077889,2020-09-18 01:09:01,i srsly think this is my favorite phone of all time it was thick af but it was utterly amazing to type on amp so advanced for its time i could thumb type wpm with my eyes closed god i loved that phone samsung schi specs features phone scoop  ,kurtsh,,,"Los Angeles, CA, USA",positive
320,1306764267887026178,2020-09-18 01:17:34, it is definitely not my kind of phone it is way too expensive and when folded it looks and feels strange  now as for multitasking i do not see it doing anything that samsung phones from  to present could not do except dex wireless i do believe its the best multitasking phone,InRSoul247,,,"Orange, California, USA",negative
321,1306767529684226052,2020-09-18 01:30:32, samsung phones have an app and you can watch all the games you want ,saballes8470,,"Frisco, TX","Texas, y'all!!! 🤠",neutral
322,1306789396373479425,2020-09-18 02:57:25, samsung has consistently made a superior phone w the galaxy and note series   only problem is android has too many competitors and at the end of the day their user base a majority only care about the camera which indeed is superior but the other features get ignored,theofletcherII,,,"Nashville, TN",positive
323,1306800270983168012,2020-09-18 03:40:38, it does not work on samsung smarttv  so i had to watch on my laptop,cordog1969,,,"Florida, USA",negative
324,1306810106248654851,2020-09-18 04:19:43,oups i forgot cannot plug samsung earbuds and charge my samsung galaxy s g phone at the same time can someone please ask  people what they were thinking,CreativeBlueON,,,"Toronto, Ontario",negative
325,1306810160757710855,2020-09-18 04:19:56, i have a samsung galaxy right now pretty happy with the phone it has just the lack of a good watch that bothers me,thegautamgupta,,,"Vancouver, British Columbia",positive
326,1306818186357215233,2020-09-18 04:51:49, admittedly i never owned this phone my first was a silver razr vm but then i had a samsung glyde but i thought the juke was awesome,anderson_cooter,,,"Oakland, CA",positive
327,1306820033109204993,2020-09-18 04:59:10, To each their own i just love that i have got a translucent calendar widget just sitting on my home screen To me it looks sleek and it is functional to boot  there is more to customize but the translucenttransparent widgets are what sold me on Samsung phones in particular ,SiO2moyer,,,"Vermont, USA",positive
328,1306821373818413056,2020-09-18 05:04:29, i got the  samsung curve screen and it the best tv ive ever had they do a flat screen version too youre looking at about  but it totally worth it,lcfrst2,,,"Vancouver, British Columbia",positive
329,1306824062375727104,2020-09-18 05:15:10,its amazing how samsung phone speakers get instantly better when you turn on dolby atmos lol,Vyyyper,,,Chicago,positive
330,1306825672896270336,2020-09-18 05:21:34, i tried it last night on my samsung phone and it was sooooo good until my wifi cut out,lalalaheath,,,"Houston, TX",positive
331,1306835573756231681,2020-09-18 06:00:55, they do not support the fold either this is what it looks like by default samsung has a utility you can download that forces apps to go full screen that am not tablet optimized ,SnazzyQ,,,"Salt Lake City, Utah",neutral
332,1306850857271595011,2020-09-18 07:01:39,samsung has a new superpremium version of its galaxy watch  smartwatch  techradar  smartwatch news,SmartWatchesNow,,,USA,neutral
333,1306866666039644161,2020-09-18 08:04:28, samsung depends on what you use your phone for off the top of my head  good sizeweight good battery good camera lots of memory no japanese keyboard you have to download and install it from elsewhere  clunky music setup not the best photo editing,AKK0324,,,USA,positive
334,1306877135445995520,2020-09-18 08:46:04,i would not recommend the s line up to anyone for the main fact that refuses to fix the issue they have with the back camera glass not being reinforced and claims its “cosmetic damage and charges  if a Samsung member and  if you are not all for a part,hdtrolio,,,"Pennsylvania, USA",negative
335,1306882096955305986,2020-09-18 09:05:47,what is samsung doing   i went to streamcast from my samsung a phone to my samsung series  tv now they downloaded an update on my dime demanding that i can only stream through their sites anybody else see this predatory problem,tombradshaw7777,,,"Worthington, MN",negative
